[
  {
    "schema_version": "ip-director-concept-v1",
    "runtime_status": "research_quarantined",
    "contract_id": "valid-person-led",
    "system": {
      "target_public": "正在经历职业转折并需要可信行动参照的人",
      "desired_relation_changes": ["recognition", "trust", "action"],
      "desired_action": "持续关注并对明确服务发起咨询",
      "boundary": "只使用本人确认的经历和可持续行动，不代替本人诊断隐性动机",
      "time_horizon": "十二周试拍期"
    },
    "ontology": {
      "entities": [
        {
          "id": "person-operator",
          "kind": "person",
          "name": "项目本人",
          "epistemic_state": "user_asserted"
        },
        {
          "id": "offer-1",
          "kind": "product",
          "name": "当前服务",
          "epistemic_state": "user_asserted"
        },
        {
          "id": "audience-1",
          "kind": "audience",
          "name": "目标公众",
          "epistemic_state": "hypothesized"
        }
      ],
      "operated_subject_ref": "person-operator",
      "operated_subject_kind": "person",
      "primary_carrier_ref": "person-operator",
      "role_assignments": [
        {
          "entity_ref": "person-operator",
          "role_kind": "life_role",
          "role": "当前职业阶段",
          "valid_time": "当前，起止时间未知"
        }
      ],
      "brand_cognition": {
        "attribution_target_refs": ["person-operator"],
        "desired_associations": ["会把复杂改变落实成可见行动"]
      }
    },
    "information": {
      "claims": [
        {
          "id": "pc1",
          "kind": "fact",
          "state": "user_asserted",
          "statement": "本人正在经历一次明确的职业转折",
          "subject_refs": ["person-operator"],
          "source_refs": ["user:message-1"],
          "basis_refs": [],
          "coverage": "本人当前陈述"
        },
        {
          "id": "pc2",
          "kind": "desire",
          "state": "user_asserted",
          "statement": "本人希望在十二周内完成一个可观察的新阶段",
          "subject_refs": ["person-operator"],
          "source_refs": ["user:message-1"],
          "basis_refs": [],
          "coverage": "本人明确目标"
        },
        {
          "id": "pc3",
          "kind": "desire",
          "state": "hypothesized",
          "statement": "目标公众希望看见普通人如何在现实限制下完成改变",
          "subject_refs": ["audience-1"],
          "source_refs": [],
          "basis_refs": [],
          "coverage": "待样片验证的受众假设"
        },
        {
          "id": "pc4",
          "kind": "objective",
          "state": "user_asserted",
          "statement": "希望由内容带来与当前服务有关的合格咨询",
          "subject_refs": ["offer-1"],
          "source_refs": ["user:message-1"],
          "basis_refs": [],
          "coverage": "本轮商业目标"
        },
        {
          "id": "pc5",
          "kind": "constraint",
          "state": "user_asserted",
          "statement": "每周只能完成一次低成本拍摄",
          "subject_refs": ["person-operator"],
          "source_refs": ["user:message-1"],
          "basis_refs": [],
          "coverage": "当前生产能力"
        }
      ]
    },
    "semantic": {
      "frame": {
        "surface_terms": ["当前职业身份", "转折"],
        "head_concept": "一个跨时间持续存在的人",
        "modifiers": ["当前职业角色", "转折阶段"],
        "event_roles": ["行动者", "旧状态", "目标状态", "现实反作用"]
      },
      "de_labelling": {
        "subject_without_labels": "一个拥有过去、当前目标和未来状态的人",
        "role_reintroduced_effect": "当前职业角色只增加时间、资源和声誉代价",
        "result": "pass"
      }
    },
    "direction": {
      "candidate_worlds": [
        {
          "id": "person-candidate-1",
          "social_domain": "训练与进阶",
          "semantic_distance": "near",
          "relation_structure": ["设定里程碑", "执行训练", "暴露差距", "修正策略"],
          "desire_subject_ref": "person-operator",
          "fact_refs": ["pc1", "pc2", "pc5"],
          "assumptions": ["公众会对过程中的真实策略变化感兴趣"],
          "premise": "用每周一次真实行动记录一个人如何跨过职业转折"
        },
        {
          "id": "person-candidate-2",
          "social_domain": "航行与校准",
          "semantic_distance": "far",
          "relation_structure": ["确定目的地", "读取环境反馈", "调整航向", "承担绕行代价"],
          "desire_subject_ref": "person-operator",
          "fact_refs": ["pc1", "pc2", "pc5"],
          "assumptions": ["航向校准结构能转译为可见职业决策"],
          "premise": "把每次职业选择当作一次有反馈的航向修正"
        },
        {
          "id": "person-candidate-3",
          "social_domain": "修复与复原",
          "semantic_distance": "far",
          "relation_structure": ["识别断裂", "保留可用部分", "替换失效结构", "验证新状态"],
          "desire_subject_ref": "person-operator",
          "fact_refs": ["pc1", "pc2"],
          "assumptions": ["本人愿意把失败策略作为创作假设公开"],
          "premise": "以修复而非逆袭的视角重建一个人的工作方法"
        }
      ],
      "desire_model": {
        "creator_desire_claim_refs": ["pc2"],
        "audience_desire_claim_refs": ["pc3"],
        "commercial_objective_claim_refs": ["pc4"]
      },
      "selected_candidate_ref": "person-candidate-2",
      "selection_reason": "它保留真实行动和反馈，同时摆脱职业标签附近的常见励志表达",
      "tradeoff": "需要持续暴露策略调整，不能只展示成功结果",
      "four_anchors": {
        "attention": {
          "entity_ref": "person-operator",
          "mechanism": "每次行动都面临一个可判断成败的现实选择"
        },
        "trust": {
          "entity_ref": "person-operator",
          "mechanism": "使用可观察的行动、反馈和策略变化而非自我评价"
        },
        "meaning": {
          "entity_ref": "person-operator",
          "mechanism": "让公众把持续校准而非一次成功归因给本人"
        },
        "transaction": {
          "entity_ref": "offer-1",
          "mechanism": "由公开的方法证明自然连接到服务咨询"
        }
      },
      "communication": {
        "mode": "story",
        "account_narrative": "一个人在十二周内用真实行动从旧状态走向新状态",
        "desire_behavior": {
          "epistemic_state": "creative",
          "source_candidate_ref": "person-candidate-2",
          "fact_refs": ["pc1", "pc2", "pc5"],
          "assumptions": ["具体职业选择、失败反馈和公开过程是待验证创作情境"],
          "subject_ref": "person-operator",
          "commercial_object_mode": "absent",
          "substitution_test": "本集不让服务或商品进入故事世界，移除业务名称后人物的行动、反馈和状态变化保持完整",
          "semantic_action": "在转折期做出一次可观察的职业选择",
          "relationship_at_stake": "本人同旧方法及目标公众信任之间的关系",
          "trigger": "熟悉做法无法推进明确的新阶段",
          "want": "完成明确的新阶段",
          "goal": "在十二周里完成一个可以被观察的新工作路径",
          "initial_tactic": "继续沿用熟悉做法并只展示预期结果",
          "counterforce": "有限时间与旧方法的惯性",
          "feedback": "旧策略没有产生预期进展，也无法让公众看见真实能力",
          "strategy_change": "公开一次策略失效并改用可观察的小步试验",
          "costly_choice": "在维持熟悉感与暴露不确定性之间选择后者",
          "cost": "公开一次策略失效并放弃熟悉做法",
          "state_change": "从重复旧策略转为建立一条新的工作路径",
          "viewer_desire": "确认这个人能否在现实限制下改变方法并抵达新阶段",
          "logline": "当熟悉做法再也推不动职业转折，一个想在十二周内进入新阶段的人仍试图只展示结果，却被停滞迫使他在保住体面和公开失败之间选择，最终用一次可观察的小试验换掉了旧工作路径。"
        }
      },
      "marketing": {
        "viewer_desire": "确认现实限制下是否仍能改变",
        "reason_to_choose": "看到可复用的决策过程而不是抽象鼓励",
        "reason_to_believe": "行动、反馈和调整过程可以被持续观察",
        "desired_behavior": "关注后续并在需要同类帮助时发起咨询",
        "business_connection": "服务是方法能力的交付，不在剧情结尾强行露出"
      },
      "production": {
        "expression_carriers": ["本人低表演纪录", "声音复盘", "行动物证"],
        "constraints": ["每周一次拍摄"],
        "feasibility_reason": "主内容来自真实行动和物证，不依赖多人表演"
      },
      "stress_test": {
        "episode_generators": [
          "第一次设定里程碑",
          "旧方法首次失效",
          "一次主动求助",
          "一次资源减少",
          "一次拒绝熟悉机会",
          "一次公开修正判断",
          "一次小范围成功",
          "一次外部规则变化",
          "一次目标停滞",
          "一次关系支持",
          "一次有代价的取舍",
          "阶段终点复核"
        ],
        "label_removal_result": "pass",
        "role_reintroduction_result": "pass",
        "no_hotspot_result": "pass",
        "resource_reduction_result": "pass"
      }
    },
    "control": {
      "pilot_hypothesis": "一次完整的选择—反馈—修正比身份自述更能形成可信记忆",
      "single_variable": "是否展示一次真实策略变化",
      "observation_window": "首条发布后七天",
      "success_signal": "目标公众能复述选择和变化并提出与方法有关的问题",
      "failure_signal": "反馈只停留在身份标签或泛化鼓励",
      "revision_rule": "若失败，先重做可见行动和反馈，不增加身份标签与视觉包装"
    }
  },
  {
    "schema_version": "ip-director-concept-v1",
    "runtime_status": "research_quarantined",
    "contract_id": "valid-product-led",
    "system": {
      "target_public": "需要在移动环境中快速整理工具的人",
      "desired_relation_changes": ["recognition", "trust", "preference", "action"],
      "desired_action": "申请试用并在验证后购买",
      "boundary": "只展示已完成的产品能力和可重复测试",
      "time_horizon": "四周验证期"
    },
    "ontology": {
      "entities": [
        {
          "id": "product-operator",
          "kind": "product",
          "name": "模块化工具组件",
          "epistemic_state": "user_asserted"
        },
        {
          "id": "maker-org",
          "kind": "organization",
          "name": "产品团队",
          "epistemic_state": "user_asserted"
        },
        {
          "id": "audience-worker",
          "kind": "audience",
          "name": "移动作业者",
          "epistemic_state": "hypothesized"
        }
      ],
      "operated_subject_ref": "product-operator",
      "operated_subject_kind": "product",
      "primary_carrier_ref": "product-operator",
      "role_assignments": [],
      "brand_cognition": {
        "attribution_target_refs": ["product-operator", "maker-org"],
        "desired_associations": ["能以可重复测试改善移动作业秩序"]
      }
    },
    "information": {
      "claims": [
        {
          "id": "pd1",
          "kind": "fact",
          "state": "user_asserted",
          "statement": "组件可以在移动工作空间中重新排列",
          "subject_refs": ["product-operator"],
          "source_refs": ["user:message-1"],
          "basis_refs": [],
          "coverage": "用户陈述的当前产品能力"
        },
        {
          "id": "pd2",
          "kind": "desire",
          "state": "hypothesized",
          "statement": "移动作业者希望减少寻找和掉落造成的失控",
          "subject_refs": ["audience-worker"],
          "source_refs": [],
          "basis_refs": [],
          "coverage": "待实测的受众欲望"
        },
        {
          "id": "pd3",
          "kind": "objective",
          "state": "user_asserted",
          "statement": "产品团队希望获得真实试用与购买",
          "subject_refs": ["maker-org", "product-operator"],